{
  "schema_version": 1,
  "id": "task-example-followup",
  "title": "确认下一阶段安排",
  "assigner_id": "member-a",
  "assignee_id": "member-b",
  "project_id": "none",
  "safe_context": "只交换协调信息，不包含公司资料。",
  "priority": "medium",
  "status": "assigned",
  "health": "yellow",
  "status_reason": "任务已派发，等待负责人确认接收。",
  "due": "2026-09-01T18:00:00+08:00",
  "next_action": "确认执行时间并反馈状态。",
  "blocker": "none",
  "done_criteria": "负责人、执行日期和下一动作均已确认。",
  "check_date": "2026-08-28",
  "source_reference": "COMPANY-TASK-042",
  "safe_evidence": "none",
  "confidentiality": "coordination_only",
  "revision": 1,
  "updated_at": "2026-08-18T16:00:00+08:00",
  "updated_by": "member-a"
}
